{
  "$schema": "../theory-review-batch.schema.json",
  "schemaVersion": "1.0.0",
  "batchId": "theory-900-cross-review-2026-07-26-v1",
  "shardId": "single-101-200",
  "reviewedBy": "codex-cross-reviewer-single",
  "reviewStage": "qa",
  "reviews": [
    {
      "questionId": "single-101",
      "questionFingerprint": "f3760280f50b21700f4a86a628ba2ee440cd6fd2a18d58fdf92f581f891acc5e",
      "reviewedAnswer": [
        "B"
      ],
      "generatedExplanation": "产生式系统以“如果条件成立，则执行结论或动作”的规则表示知识，并通过规则匹配和推理求解问题，是专家系统的经典知识表示方式。自然语言、图像和语音任务可以使用规则，但现代核心方法通常不是产生式系统。",
      "notes": []
    },
    {
      "questionId": "single-102",
      "questionFingerprint": "ac905cce92b4c72cde4feaf09ef8a7c48918bb8559e8f9f009b9286854f00ab0",
      "reviewedAnswer": [
        "B"
      ],
      "generatedExplanation": "知识图谱本质上是图结构：实体作为节点，实体间的语义关系作为连接节点的边。XML或数据库表可以作为存储格式，神经网络也可学习嵌入，但都不是知识图谱最基本的结构表示。",
      "notes": []
    },
    {
      "questionId": "single-103",
      "questionFingerprint": "16384e7185a7cd4ae05de0aa8c6050411686c3a6a9c5aec76fc2dd3db36b75cc",
      "reviewedAnswer": [
        "A"
      ],
      "generatedExplanation": "数据处理工具首先承担格式整理、缺失处理、去重和转换等清洗与预处理工作，使原始数据可用于后续分析。复杂分析、图表展示和数据采集分别更接近分析、可视化和采集工具的主要职责。",
      "notes": []
    },
    {
      "questionId": "single-104",
      "questionFingerprint": "5fb42d0bd77896ac9de76201f325d84ac050beb96e999a13d0f4abda5bb8811c",
      "reviewedAnswer": [
        "D"
      ],
      "generatedExplanation": "因果分析法围绕变量之间的原因、结果和作用路径建立结构化假设，用于解释现象为何发生以及某因素会带来什么影响。时间序列关注时间变化，决策树和神经网络主要用于预测或分类。",
      "notes": []
    },
    {
      "questionId": "single-105",
      "questionFingerprint": "085597209ba1d6c16f6428881eaf19efc25c8f9222515ba49d8b41e6d5930361",
      "reviewedAnswer": [
        "C"
      ],
      "generatedExplanation": "分析数据阶段需要探索分布、关系、趋势和异常，并结合业务背景解释其含义，正是对数据进行深入探讨和理解。收集与清洗负责准备数据，得出结论则是在分析结果基础上的归纳。",
      "notes": []
    },
    {
      "questionId": "single-106",
      "questionFingerprint": "d4d7786e35a55cff9ca5e40029d107ca765037f44737d1fc34d15872fd3004fe",
      "reviewedAnswer": [
        "A"
      ],
      "generatedExplanation": "监督学习使用带有已知标签或目标值的数据训练映射关系，再预测新样本的类别或连续数值。特征、分布和关联性可以作为研究对象，但不是监督学习预测目标的一般定义。",
      "notes": []
    },
    {
      "questionId": "single-107",
      "questionFingerprint": "4f01e5c6089fbdbfe45e7cfd401341500e965aa052423dc608b3293f113faf8f",
      "reviewedAnswer": [
        "A"
      ],
      "generatedExplanation": "卷积层用可学习卷积核扫描局部区域，逐层提取边缘、纹理和更高层语义特征。池化层主要下采样，全连接层用于汇总决策，激活层引入非线性而不直接完成局部特征提取。",
      "notes": []
    },
    {
      "questionId": "single-108",
      "questionFingerprint": "662a404319fe4086b083b0d92e57b7b4dc7853f27942b8edba922d982af18931",
      "reviewedAnswer": [
        "D"
      ],
      "generatedExplanation": "主成分分析把原始变量线性组合成少量能保留主要方差的主成分，是常见的特征提取方法。决策树和贝叶斯分类器用于监督预测，K均值主要用于聚类。",
      "notes": []
    },
    {
      "questionId": "single-109",
      "questionFingerprint": "b8ad075cf727d9f223b3532426a924d016709cb249d317c4a8f8ea53a5e383fd",
      "reviewedAnswer": [
        "A"
      ],
      "generatedExplanation": "根据训练阶段调整学习率，可以在前期快速下降、接近最优点时减小振荡，从而兼顾收敛速度和稳定性。梯度裁剪主要防止梯度爆炸，早停防止过拟合，“动量减速”也不是标准优化策略名称。",
      "notes": []
    },
    {
      "questionId": "single-110",
      "questionFingerprint": "eb1204ad77d4b5e36b6be2075b3db2603c5917e18339572ba462ffd6ab4928ca",
      "reviewedAnswer": [
        "A"
      ],
      "generatedExplanation": "信息增益衡量加入某特征后目标变量不确定性下降的程度，可在不训练完整模型的情况下对特征独立打分，符合过滤法。包装法需要反复训练模型，嵌入法则在模型训练过程中完成选择。",
      "notes": [
        "交叉复核暂保留 A；信息增益、相关系数、方差阈值和互信息都可作为过滤式特征选择准则，题干应增加“基于熵”等限定。"
      ]
    },
    {
      "questionId": "single-111",
      "questionFingerprint": "ffd96c7e3c43fe5b7b9c1542ca74dce876b8164849d3a88a31107a4f39a64b66",
      "reviewedAnswer": [
        "B"
      ],
      "generatedExplanation": "缩放通过改变图像宽高或缩放比例，直接改变图像大小，并可能改变显示形状。裁剪删除局部区域，旋转改变方向，平移只改变内容位置。",
      "notes": [
        "交叉复核暂保留 B；非等比缩放可改变大小和形状，但裁剪同样会改变图像尺寸与外形，建议明确考查“按比例调整尺寸”。"
      ]
    },
    {
      "questionId": "single-112",
      "questionFingerprint": "9af564c8d6c5ba4a171c79f5a5332e2bfd42111c3fe283081eaf6be8b15f9dd4",
      "reviewedAnswer": [
        "C"
      ],
      "generatedExplanation": "分区键的取值经过哈希、范围或其他路由规则，决定一条数据应被放入哪个分片。主键和唯一键负责标识或约束记录，外键维护表间引用，都不必然承担分片路由。",
      "notes": []
    },
    {
      "questionId": "single-113",
      "questionFingerprint": "acdb222bf79e902763a94ecc4a1532ad19dafb7a372bdc15eb65e3a2c648e084",
      "reviewedAnswer": [
        "B"
      ],
      "generatedExplanation": "自动标注通常利用机器学习模型从已有标注样本学习规律，再为新数据预测标签。计算机程序和自动化是实现形式，数据挖掘是较宽泛的数据分析概念，都不如机器学习算法准确。",
      "notes": []
    },
    {
      "questionId": "single-114",
      "questionFingerprint": "3e765bd1f9d3c5037dc333a7113755d9ceecb6575b7c510e316c75829c16c93d",
      "reviewedAnswer": [
        "A"
      ],
      "generatedExplanation": "召回率衡量所有实际正例中被模型正确找出的比例，标准公式是 TP÷(TP+FN)，即真正例数除以真正例数与假负例数之和。准确率统计全部样本预测正确的比例，其余选项也没有构成召回率。",
      "notes": [
        "交叉复核保留官方答案 A；选项 A 的排版不是合法公式，应修订为 TP /（TP + FN）后再发布题面。"
      ]
    },
    {
      "questionId": "single-115",
      "questionFingerprint": "69f3f393cbfcf444c851f3d3d7f3945bbc7569e6400889dd5fe57900d3205612",
      "reviewedAnswer": [
        "B"
      ],
      "generatedExplanation": "准确率直接计算分类正确的样本占总样本的比例，是评估分类预测正确性的常用指标。均方误差和均方根误差主要用于回归，对数损失衡量概率预测质量但不等同于正确样本比例。",
      "notes": []
    },
    {
      "questionId": "single-116",
      "questionFingerprint": "2d1c58933e1f5a917f9b486b975d344bb6bd86699e39d9b9097a2bf980d1812a",
      "reviewedAnswer": [
        "D"
      ],
      "generatedExplanation": "Keras 提供简洁的高层神经网络接口，可用较少代码快速搭建、修改和试验模型，适合深度学习原型验证。TensorFlow和PyTorch控制粒度更高，Scikit-learn则更适合传统机器学习任务。",
      "notes": [
        "交叉复核暂保留 D；Keras 更适合快速搭建深度学习原型，若题干泛指传统机器学习，Scikit-learn 也可成立。"
      ]
    },
    {
      "questionId": "single-117",
      "questionFingerprint": "241863fb9d4463406e1d597e74ce10aefa8ae3b69d31cb556f83b80bbb8d34c7",
      "reviewedAnswer": [
        "A"
      ],
      "generatedExplanation": "NumPy以连续内存、多维数组和底层向量化实现提供高效数值计算，是其数据处理优势所在。字符串处理、绘图和数据库连接分别由其他专门库更好地完成。",
      "notes": []
    },
    {
      "questionId": "single-118",
      "questionFingerprint": "fd816f8985a7be6d4168c5ff021dbf9bedd33e47c0e36c59750d71eda4499e5c",
      "reviewedAnswer": [
        "A"
      ],
      "generatedExplanation": "问卷可以预先设置固定题目、选项和量表，回收结果天然形成结构化记录，便于统计。访谈与观察往往产生文本或现场记录，实验法描述的是研究设计而非特定的数据结构。",
      "notes": []
    },
    {
      "questionId": "single-119",
      "questionFingerprint": "4591a2139944a868f6c4af5623b4196061d4740379ac4c99471ea9435b003bad",
      "reviewedAnswer": [
        "C"
      ],
      "generatedExplanation": "机器学习机制可利用新增样本、人工纠错和反馈持续更新模型，使自动标注规则随数据改善。随机猜测不能积累能力，专家系统依赖固定规则，手动校验本身也不会自动优化系统。",
      "notes": []
    },
    {
      "questionId": "single-120",
      "questionFingerprint": "5f4ee73b670534fb017357821ecf2e4bfcc1f1a261ff6d3b7bf00dd97b25684a",
      "reviewedAnswer": [
        "B"
      ],
      "generatedExplanation": "Pandas提供DataFrame、文件读取、缺失处理、筛选和类型转换等功能，主要用于表格数据加载与预处理。NumPy偏数组计算，Matplotlib负责绘图，Scikit-learn侧重建模与机器学习流程。",
      "notes": []
    },
    {
      "questionId": "single-121",
      "questionFingerprint": "32851e4c6301ab20e352cc4b42d30ec23cf0df52f464129e29718483726680f8",
      "reviewedAnswer": [
        "C"
      ],
      "generatedExplanation": "早停在验证集性能不再改善时终止训练，避免模型继续贴合训练噪声，从而抑制过拟合。增加复杂度或减少数据通常会加重过拟合，仅限制一层隐藏层也不是通用有效方法。",
      "notes": []
    },
    {
      "questionId": "single-122",
      "questionFingerprint": "d6e1dac42ed5dd87768a5c4ad1379208ce92c0ff87792202231847eeff93df3b",
      "reviewedAnswer": [
        "D"
      ],
      "generatedExplanation": "交叉验证在不同训练与验证折叠上重复评估，观察模型对未参与训练样本的表现，从而估计泛化能力。它可能辅助提高最终效果，但主要目的不是加速训练、简化模型或直接增加准确率。",
      "notes": []
    },
    {
      "questionId": "single-123",
      "questionFingerprint": "826b237651929816d67440c716b35e92d69a9076d1d5fe36739ed47b68043975",
      "reviewedAnswer": [
        "B"
      ],
      "generatedExplanation": "模型训练就是通过多轮前向计算、误差反传和参数更新持续优化模型性能，自动化工具可编排这一迭代过程。模型评估只衡量结果，特征工程和数据清洗处理的是输入数据。",
      "notes": []
    },
    {
      "questionId": "single-124",
      "questionFingerprint": "fa918b8563123f93a610caf922b35c455d1e511962f17d1dff600c752982a2ed",
      "reviewedAnswer": [
        "B"
      ],
      "generatedExplanation": "ELK Stack由Elasticsearch、Logstash和Kibana组成，分别支持日志采集处理、检索分析和实时可视化。Hadoop面向通用大数据处理，TensorFlow和PyTorch是机器学习框架。",
      "notes": []
    },
    {
      "questionId": "single-125",
      "questionFingerprint": "162bab6f42cda2b3a5b9d03ef7b417252ebeb041256ddd75c1306d18c34c8697",
      "reviewedAnswer": [
        "A"
      ],
      "generatedExplanation": "面向图像生成的GAN通常用卷积或转置卷积网络把潜变量逐步映射为空间特征和图像，因此卷积神经网络是典型生成器结构。循环网络更适合序列，自编码器是另一类架构，GAN是整体训练框架而非生成器内部类型。",
      "notes": []
    },
    {
      "questionId": "single-126",
      "questionFingerprint": "ffcac028a1609601fea3bc33ed59bcca3904eed9fa578c2242f08a0704b6117e",
      "reviewedAnswer": [
        "A"
      ],
      "generatedExplanation": "Python和R拥有成熟的数据整理、统计、可视化与机器学习库，能显著降低实现常见训练流程的成本。它们仍需要编程能力，也不是唯一选择或在所有任务中速度最快的语言。",
      "notes": []
    },
    {
      "questionId": "single-127",
      "questionFingerprint": "fd37645d6d139ce868365afe41f2e452f1b8f8a2ec650daa3362e288acf1eaa2",
      "reviewedAnswer": [
        "D"
      ],
      "generatedExplanation": "部署过程包括选择运行环境、发布模型文件并用测试验证服务是否正确；对模型进行微调属于训练与优化阶段，不是部署工具的典型使用步骤。部署后的监控可触发再训练，但仍应与部署操作区分。",
      "notes": []
    },
    {
      "questionId": "single-128",
      "questionFingerprint": "fea8ef27c2402a1266ca9f3fdf64e74f161f73ac4c9a4d4ebb64bf44012c6b92",
      "reviewedAnswer": [
        "A"
      ],
      "generatedExplanation": "探索性分析揭示业务数据中的趋势、分群、异常和关键关联，可为目标选择、资源配置等业务策略制定提供依据。产品、营销和客户管理都是可能应用方向，但属于策略落地的具体领域。",
      "notes": []
    },
    {
      "questionId": "single-129",
      "questionFingerprint": "43c4e52033bbb17148d2fafc97beef0bb0f0d3c491c6700c6a159a796bc7aeba",
      "reviewedAnswer": [
        "A"
      ],
      "generatedExplanation": "直方图、箱线图、散点图等可视化能直观显示数据类型、分布、离群点和变量关系，是理解结构和特点的首要手段。统计分析可进一步量化，数据挖掘和机器学习则通常在初步理解之后开展。",
      "notes": []
    },
    {